{
  "acceptance": {
    "decisionRef": null,
    "falseCompletion": false,
    "status": "not_adjudicated",
    "verifier": {
      "assertions": [],
      "status": "not_run",
      "verifierId": "HARNESS-REPO-REPAIR-001-verifier",
      "verifierRevision": "1"
    }
  },
  "artifacts": [],
  "failureRefs": [
    "failure:b5-native-004:primary"
  ],
  "integrity": {
    "algorithm": "sha256",
    "canonicalization": "ordivon-evidence-json-v1",
    "payloadDigest": "sha256:dc8118366f388ce3bfc375a200c868e46daca9094051384b34001b0f80b6f032"
  },
  "kind": "ordivon.evaluation-result",
  "limitations": [
    "Unfiltered Provider payloads and auxiliary model internals are not retained.",
    "Estimated monetary cost is unavailable from the Provider response."
  ],
  "metrics": {
    "cachedInputTokens": 7296,
    "estimatedCostUsd": null,
    "humanInterventionCount": 0,
    "inputTokens": 10869,
    "invalidToolCalls": 2,
    "modelCalls": 4,
    "observationBytes": 6276,
    "outputTokens": 743,
    "reasoningTokens": 0,
    "repeatedCommands": 0,
    "repeatedReads": 1,
    "runtimeJobs": 0,
    "toolCalls": 6,
    "totalTokens": 11612,
    "wallTimeMs": 18783
  },
  "schemaVersion": 1,
  "stopCode": "no_progress",
  "taskRef": {
    "taskId": "HARNESS-REPO-REPAIR-001",
    "taskVersion": 1
  },
  "trace": {
    "digest": "sha256:9196600820e62b6328b3695bd0b2bc3e36a61653f6cb0da3b4e1234f8b922290",
    "eventCount": 38,
    "ref": "harness-run:harness-run:b5-native-004"
  },
  "trialId": "trial:b5-native-004"
}
